[
  {
    "source_id": "related-source-BATCH-2026-002-002",
    "canonical_title": "Zero Trust Networks — Audiobook",
    "alternate_titles": [],
    "source_type": "audiobook",
    "series_or_parent_source": null,
    "publisher": "Ascent Audio / O’Reilly",
    "channel": null,
    "speaker_ids": [],
    "author_ids": [],
    "institutional_author": "Ascent Audio / O’Reilly",
    "organization_references": [],
    "recorded_at": null,
    "event_date": null,
    "published_at": null,
    "updated_at": null,
    "duration_seconds": null,
    "language": "lang-en",
    "translated_title": null,
    "translation_method": null,
    "geography_of_speaker": [],
    "geography_of_organization": [],
    "geography_discussed": [
      "geo-global"
    ],
    "study_geography": [],
    "original_url": "https://www.oreilly.com/library/view/zero-trust-networks/9781663735591/",
    "canonical_url": "https://www.oreilly.com/library/view/zero-trust-networks/9781663735591/",
    "archived_url": null,
    "embed_url": null,
    "doi": null,
    "canonical_identity_status": "machine_verified_human_pending",
    "repost_status": "original_or_official",
    "original_source_id": null,
    "rights_status": "metadata_only",
    "ownership_status": "third_party",
    "relationship_to_off": "none_identified",
    "transcript_status": null,
    "transcript_source": null,
    "transcript_republication_permission": null,
    "chapter_markers": [],
    "analysis_basis": "official_metadata",
    "topics": [
      "governed-agent-identities",
      "book-related-source"
    ],
    "executive_roles": [
      "role-ciso",
      "role-cio",
      "role-cto"
    ],
    "original_abstract": null,
    "inclusion_rationale": "Related format and narrator metadata for book-work-BATCH-2026-002-002.",
    "source_quality_dimensions": {
      "primary_source": true,
      "bibliographic_stability": "high"
    },
    "methodology_quality": {
      "not_applicable": true
    },
    "study_design": null,
    "sample": {},
    "population": null,
    "date_range": {},
    "funding": null,
    "sponsor": null,
    "peer_review_status": null,
    "findings": [],
    "limitations": [
      "Candidate related source only; not accepted for statement extraction."
    ],
    "correction_ids": [],
    "retraction_status": null,
    "content_hash": null,
    "accessed_at": "2026-08-15",
    "verification_status": "machine_verified_human_approved",
    "source_depth": "metadata_only",
    "publication_status": "published",
    "workflow_status": "published",
    "machine_review_status": "ready_for_human_review",
    "human_review_status": "approved",
    "reviewed_by": "Murray Newlands",
    "reviewed_at": "2026-08-16T23:17:22Z",
    "provenance": [
      {
        "source_url": "https://www.oreilly.com/library/view/zero-trust-networks/9781663735591/",
        "accessed_at": "2026-08-15",
        "retrieval_method": "Official publisher, project, or author-hosted bibliographic page inspected through public web access",
        "exact_locator": "Official related-source page",
        "content_hash": null,
        "batch_id": "BATCH-2026-002",
        "prompt_id": "OEII-BOOK-METADATA",
        "prompt_version": "2.0",
        "notes": "Related format and narrator metadata for book-work-BATCH-2026-002-002."
      }
    ],
    "revision_history": [
      {
        "changed_at": "2026-08-16T23:17:22Z",
        "changed_by": "Murray Newlands",
        "summary": "Approved for the governed-identities pilot release under the exact scope, exclusions, rights treatment, and limitations recorded in issue #18.",
        "batch_id": "BATCH-2026-002"
      }
    ]
  },
  {
    "source_id": "related-source-BATCH-2026-002-003",
    "canonical_title": "OAuth 2 in Action — Authorized Chapter 1 Preview",
    "alternate_titles": [],
    "source_type": "other_approved",
    "series_or_parent_source": null,
    "publisher": "Manning Publications",
    "channel": null,
    "speaker_ids": [],
    "author_ids": [],
    "institutional_author": "Manning Publications",
    "organization_references": [],
    "recorded_at": null,
    "event_date": null,
    "published_at": null,
    "updated_at": null,
    "duration_seconds": null,
    "language": "lang-en",
    "translated_title": null,
    "translation_method": null,
    "geography_of_speaker": [],
    "geography_of_organization": [],
    "geography_discussed": [
      "geo-global"
    ],
    "study_geography": [],
    "original_url": "https://www.manning.com/preview/oauth-2-in-action/chapter-1",
    "canonical_url": "https://www.manning.com/preview/oauth-2-in-action/chapter-1",
    "archived_url": null,
    "embed_url": null,
    "doi": null,
    "canonical_identity_status": "machine_verified_human_pending",
    "repost_status": "original_or_official",
    "original_source_id": null,
    "rights_status": "link_and_paraphrase",
    "ownership_status": "third_party",
    "relationship_to_off": "none_identified",
    "transcript_status": null,
    "transcript_source": null,
    "transcript_republication_permission": null,
    "chapter_markers": [],
    "analysis_basis": "authorized_preview",
    "topics": [
      "governed-agent-identities",
      "book-related-source"
    ],
    "executive_roles": [
      "role-ciso",
      "role-cio",
      "role-cto"
    ],
    "original_abstract": null,
    "inclusion_rationale": "Limited authorized preview related to book-work-BATCH-2026-002-003.",
    "source_quality_dimensions": {
      "primary_source": true,
      "bibliographic_stability": "high"
    },
    "methodology_quality": {
      "not_applicable": true
    },
    "study_design": null,
    "sample": {},
    "population": null,
    "date_range": {},
    "funding": null,
    "sponsor": null,
    "peer_review_status": null,
    "findings": [],
    "limitations": [
      "Candidate related source only; not accepted for statement extraction."
    ],
    "correction_ids": [],
    "retraction_status": null,
    "content_hash": null,
    "accessed_at": "2026-08-15",
    "verification_status": "machine_verified_human_approved",
    "source_depth": "metadata_only",
    "publication_status": "published",
    "workflow_status": "published",
    "machine_review_status": "ready_for_human_review",
    "human_review_status": "approved",
    "reviewed_by": "Murray Newlands",
    "reviewed_at": "2026-08-16T23:17:22Z",
    "provenance": [
      {
        "source_url": "https://www.manning.com/preview/oauth-2-in-action/chapter-1",
        "accessed_at": "2026-08-15",
        "retrieval_method": "Official publisher, project, or author-hosted bibliographic page inspected through public web access",
        "exact_locator": "Official related-source page",
        "content_hash": null,
        "batch_id": "BATCH-2026-002",
        "prompt_id": "OEII-BOOK-METADATA",
        "prompt_version": "2.0",
        "notes": "Limited authorized preview related to book-work-BATCH-2026-002-003."
      }
    ],
    "revision_history": [
      {
        "changed_at": "2026-08-16T23:17:22Z",
        "changed_by": "Murray Newlands",
        "summary": "Approved for the governed-identities pilot release under the exact scope, exclusions, rights treatment, and limitations recorded in issue #18.",
        "batch_id": "BATCH-2026-002"
      }
    ]
  },
  {
    "source_id": "related-source-BATCH-2026-002-004",
    "canonical_title": "API Security in Action — Official Contents",
    "alternate_titles": [],
    "source_type": "other_approved",
    "series_or_parent_source": null,
    "publisher": "Manning Publications",
    "channel": null,
    "speaker_ids": [],
    "author_ids": [],
    "institutional_author": "Manning Publications",
    "organization_references": [],
    "recorded_at": null,
    "event_date": null,
    "published_at": null,
    "updated_at": null,
    "duration_seconds": null,
    "language": "lang-en",
    "translated_title": null,
    "translation_method": null,
    "geography_of_speaker": [],
    "geography_of_organization": [],
    "geography_discussed": [
      "geo-global"
    ],
    "study_geography": [],
    "original_url": "https://livebook.manning.com/book/api-security-in-action/contents",
    "canonical_url": "https://livebook.manning.com/book/api-security-in-action/contents",
    "archived_url": null,
    "embed_url": null,
    "doi": null,
    "canonical_identity_status": "machine_verified_human_pending",
    "repost_status": "original_or_official",
    "original_source_id": null,
    "rights_status": "link_and_paraphrase",
    "ownership_status": "third_party",
    "relationship_to_off": "none_identified",
    "transcript_status": null,
    "transcript_source": null,
    "transcript_republication_permission": null,
    "chapter_markers": [],
    "analysis_basis": "table_of_contents_only",
    "topics": [
      "governed-agent-identities",
      "book-related-source"
    ],
    "executive_roles": [
      "role-ciso",
      "role-cio",
      "role-cto"
    ],
    "original_abstract": null,
    "inclusion_rationale": "Official contents related to book-work-BATCH-2026-002-004.",
    "source_quality_dimensions": {
      "primary_source": true,
      "bibliographic_stability": "high"
    },
    "methodology_quality": {
      "not_applicable": true
    },
    "study_design": null,
    "sample": {},
    "population": null,
    "date_range": {},
    "funding": null,
    "sponsor": null,
    "peer_review_status": null,
    "findings": [],
    "limitations": [
      "Candidate related source only; not accepted for statement extraction."
    ],
    "correction_ids": [],
    "retraction_status": null,
    "content_hash": null,
    "accessed_at": "2026-08-15",
    "verification_status": "machine_verified_human_approved",
    "source_depth": "metadata_only",
    "publication_status": "published",
    "workflow_status": "published",
    "machine_review_status": "ready_for_human_review",
    "human_review_status": "approved",
    "reviewed_by": "Murray Newlands",